{
  "schemaVersion": 1,
  "protocolVersion": "shared-space/v1",
  "sharedSpaceId": "sspace-550e8400-e29b-41d4-a716-446655440000",
  "membershipEpoch": 2,
  "priorMasterKeyFingerprint": "fingerprint-prior-master-v1",
  "newMasterKeyFingerprint": "fingerprint-new-master-v2",
  "trigger": "member_departed",
  "memberKeyEnvelopes": [
    {
      "memberId": "member-owner-001",
      "encryptedMasterKey": "shared-aes256gcm:owner-envelope-v2"
    }
  ],
  "authorizedByMemberIds": ["member-owner-001"],
  "occurredAt": "2026-07-19T12:15:00.000Z",
  "rootSignature": "ed25519:signature-key-rotation-v1"
}
